{
  "name": "classic",
  "script": "skin.js",
  "digits": 5,
  "digit_prefix": "digit",
  "sign": "sign_neg",
  "unit": {
    "V": "unit_v",
    "A": "unit_a",
    "Ω": "unit_ohm",
    "S": "unit_siemen",
    "Hz": "unit_hz",
    "%": "unit_pct",
    "°C": "unit_degc",
    "°F": "unit_degf"
  },
  "prefix": {
    "V": { "n": "prefix_n", "µ": "prefix_mu", "m": "prefix_m", "k": "prefix_k", "M": "prefix_M", "G": "prefix_G" },
    "A": { "µ": "prefix_mu", "m": "prefix_m", "k": "prefix_k", "M": "prefix_M" },
    "Ω": { "m": "prefix_m", "k": "prefix_k", "M": "prefix_M", "G": "prefix_G" },
    "Hz": { "k": "prefix_k", "M": "prefix_M" },
    "F": { "n": "prefix_n", "µ": "prefix_mu", "m": "prefix_m", "k": "prefix_k" },
    "S": { "n": "prefix_n", "µ": "prefix_mu", "m": "prefix_m" }
  },
  "icons": {
    "hold": "icon_hold",
    "relative": "icon_rel",
    "auto": "icon_auto",
    "auto_hold": "icon_ahold",
    "crest": "icon_crest",
    "record": "icon_rec",
    "max": "icon_max",
    "min": "icon_min",
    "avg": "icon_avg"
  },
  "battery_low": "icon_battery_low",
  "function": {
    "type": "text",
    "id": "fn_text"
  },
  "function_labels": {
    "LoZ-ACV": "LoZ-ACV",
    "LoZ-DCV": "LoZ-DCV",
    "AUTO": "AUTO",
    "ACV": "ACV",
    "DCV": "DCV",
    "DC+ACV": "DC+ACV",
    "Hz of VFD-ACV": "Hz of VFD-ACV",
    "VFD-ACV": "VFD-ACV",
    "ACmV": "ACmV",
    "DCmV": "DCmV",
    "DC+ACmV": "DC+ACmV",
    "ACµA": "ACµA",
    "DCµA": "DCµA",
    "DC+ACµA": "DC+ACµA",
    "ACmA": "ACmA",
    "DCmA": "DCmA",
    "DC+ACmA": "DC+ACmA",
    "%4~20mA": "%4~20mA",
    "ACA": "ACA",
    "DCA": "DCA",
    "DC+ACA": "DC+ACA",
    "T1": "T1",
    "T2": "T2",
    "T1-T2": "T1-T2",
    "Resistance": "Resistance",
    "Capacitance": "Capacitance",
    "Continuity": "Continuity",
    "Diode": "Diode",
    "nS Conductance": "nS Conductance",
    "Duty Cycle (%)": "Duty Cycle (%)",
    "Logic-Hz": "Logic-Hz",
    "EF-Lo": "EF-Lo",
    "EF-Hi": "EF-Hi",
    "Hz of Line Signal": "Hz of Line Signal"
  },
  "rtc_label": "rtc_text"
}
