{
  "name": "default",
  "digits": 5,
  "digit_prefix": "digit",
  "sign": "sign_neg",
  "unit": {
    "V": "unit_v",
    "A": "unit_a",
    "Ω": "unit_ohm",
    "Hz": "unit_hz",
    "%": "unit_pct",
    "°C": "unit_degc",
    "°F": "unit_degf"
  },
  "prefix": {
    "V": { "n": "prefix_n", "µ": "prefix_mu", "m": "prefix_m", "k": "prefix_k", "M": "prefix_M", "G": "prefix_G" },
    "A": { "µ": "prefix_mu", "m": "prefix_m", "k": "prefix_k", "M": "prefix_M" },
    "Ω": { "m": "prefix_m", "k": "prefix_k", "M": "prefix_M", "G": "prefix_G" },
    "Hz": { "k": "prefix_k", "M": "prefix_M" },
    "F": { "n": "prefix_n", "µ": "prefix_mu", "m": "prefix_m", "k": "prefix_k" },
    "S": { "n": "prefix_n", "µ": "prefix_mu", "m": "prefix_m" }
  },
  "icons": {
    "hold": "icon_hold",
    "relative": "icon_rel",
    "auto": "icon_auto",
    "auto_hold": "icon_ahold",
    "crest": "icon_crest",
    "record": "icon_rec",
    "max": "icon_max",
    "min": "icon_min",
    "avg": "icon_avg"
  },
  "battery_low": "icon_battery_low",
  "function": {
    "type": "text",
    "id": "fn_text"
  },
  "rtc_label": "rtc_text"
}
